{
  "id": "fact-costa-delisted-2024",
  "record_type": "fact",
  "statement": "Costa Group Holdings Limited, ASX code CGC, listed on 24 July 2015 and was delisted on 27 February 2024.",
  "classification": "fact",
  "confidence": "medium",
  "status": "active",
  "reviewer": "research-agent/blueberry-public-pilot-2026-08-03",
  "created_at": "2026-08-03",
  "evidence_ids": [
    "ev-delisted-costa"
  ],
  "entity_ids": [
    "company-costa-group-holdings",
    "geography-australia"
  ]
}
