{
  "id": "fact-cfia-pbr-fc11-164-1",
  "record_type": "fact",
  "statement": "A Canadian plant breeders' rights application for 'FC11-164' was filed on 29 July 2022 under number 22-11055, with provisional protection from that date, naming Peter Stefan Boches and Adam L. Wagner as breeders.",
  "classification": "fact",
  "confidence": "high",
  "status": "active",
  "reviewer": "research-agent/blueberry-public-pilot-2026-08-03",
  "created_at": "2026-08-03",
  "evidence_ids": [
    "ev-cfia-pbr-fc11-164"
  ],
  "entity_ids": [
    "variety-fc11-164",
    "company-fall-creek-farm-and-nursery"
  ]
}
