{
  "id": "fact-mbo-home-1",
  "record_type": "fact",
  "statement": "Mountain Blue Orchards Pty Ltd is an Australian blueberry grower and breeder based at Lindendale, New South Wales.",
  "classification": "fact",
  "confidence": "high",
  "status": "active",
  "reviewer": "research-agent/blueberry-public-pilot-2026-08-03",
  "created_at": "2026-08-03",
  "evidence_ids": [
    "ev-mbo-home"
  ],
  "entity_ids": [
    "company-mountain-blue-orchards",
    "geography-australia"
  ]
}
