{
  "id": "fact-blugenix-shelf-life-claim",
  "record_type": "fact",
  "statement": "Costa claims a shelf life of 27 days at 4 degrees Celsius for all five launch BluGenix varieties and up to 50 days for Eterna. No trial site, season, replication or measurement protocol is stated for either figure.",
  "classification": "claim",
  "confidence": "low",
  "status": "active",
  "reviewer": "research-agent/blueberry-public-pilot-2026-08-03",
  "created_at": "2026-08-03",
  "evidence_ids": [
    "ev-producereport-blugenix-2026"
  ],
  "entity_ids": [
    "brand-blugenix",
    "company-costa-group-holdings",
    "variety-eterna",
    "trait-postharvest-shelf-life"
  ]
}
