{
  "id": "fact-blue-maldiva-plablue-1542",
  "record_type": "fact",
  "statement": "Planasa states that its blueberry variety Blue Maldiva corresponds to the breeder selection 'Plablue 1542'.",
  "classification": "claim",
  "confidence": "high",
  "status": "active",
  "reviewer": "research-agent/blueberry-public-pilot-2026-08-03",
  "created_at": "2026-08-03",
  "evidence_ids": [
    "ev-planasa-blue-maldiva"
  ],
  "entity_ids": [
    "variety-blue-maldiva",
    "company-planasa"
  ]
}
