{
  "id": "fact-abc-chellew-judgment-2019-1",
  "record_type": "fact",
  "statement": "An Australian Federal Court judgment reported on 8 November 2019 awarded approximately A$290,000 against a grower for unauthorised propagation of a Mountain Blue variety protected by plant breeders' rights.",
  "classification": "fact",
  "confidence": "medium",
  "status": "active",
  "reviewer": "research-agent/blueberry-public-pilot-2026-08-03",
  "created_at": "2026-08-03",
  "evidence_ids": [
    "ev-abc-chellew-judgment-2019"
  ],
  "entity_ids": [
    "company-mountain-blue-orchards",
    "geography-australia",
    "variety-opi"
  ]
}
