{
  "id": "fact-ozblu-identity-julieta",
  "record_type": "fact",
  "statement": "The blueberry marketed internationally under the OZblu brand name Julieta is the breeder selection 'EB 8-42', protected in the United States by plant patent US PP25,858, granted 8 September 2015.",
  "classification": "fact",
  "confidence": "high",
  "status": "active",
  "reviewer": "research-agent/blueberry-public-pilot-2026-08-03",
  "created_at": "2026-08-03",
  "evidence_ids": [
    "ev-uspp025858-eb8-42"
  ],
  "entity_ids": [
    "variety-julieta",
    "patent-uspp025858p3",
    "brand-ozblu"
  ]
}
