{
  "id": "fact-sekoya-story-beauty",
  "record_type": "fact",
  "statement": "The SEKOYA brand name SEKOYA Beauty refers to the Fall Creek breeding selection 'FCM12-097'.",
  "classification": "fact",
  "confidence": "high",
  "status": "active",
  "reviewer": "research-agent/blueberry-public-pilot-2026-08-03",
  "created_at": "2026-08-03",
  "evidence_ids": [
    "ev-sekoya-story",
    "ev-nda-za-variety-list-2025"
  ],
  "entity_ids": [
    "variety-sekoya-beauty",
    "brand-sekoya",
    "company-fall-creek-farm-and-nursery"
  ]
}
