{
  "id": "fact-uspp031605-ridley-1602-1",
  "record_type": "fact",
  "statement": "The cultivar 'Ridley 1602', marketed as Eureka Sunrise, is a cross of 'Ridley 1403' with 'Ridley 4609', bred at Lindendale, New South Wales in 2011 under breeding designation 'M14-16-02', and is covered by United States plant patent USPP031605P3 granted 31 March 2020.",
  "classification": "fact",
  "confidence": "high",
  "status": "active",
  "reviewer": "research-agent/blueberry-public-pilot-2026-08-03",
  "created_at": "2026-08-03",
  "evidence_ids": [
    "ev-uspp031605-ridley-1602"
  ],
  "entity_ids": [
    "variety-eureka-sunrise",
    "variety-eureka",
    "patent-uspp031605p3",
    "company-mountain-blue-orchards"
  ]
}
