{
  "id": "fact-fruitist-financing-2025",
  "record_type": "fact",
  "statement": "Fruitist raised US$150 million of equity financing led by JP Morgan, reported 10 November 2025, with Steve Magami named as co-founder and chief executive.",
  "classification": "fact",
  "confidence": "high",
  "status": "active",
  "reviewer": "research-agent/blueberry-public-pilot-2026-08-03",
  "created_at": "2026-08-03",
  "event_date": "2025-11-10",
  "evidence_ids": [
    "ev-foodnavigator-fruitist-2025",
    "ev-agrovision-10-years-2024"
  ],
  "entity_ids": [
    "company-agrovision"
  ]
}
