{
  "id": "fact-fruitnet-romania-2024-1",
  "record_type": "fact",
  "statement": "Fall Creek Farm & Nursery acquired a Romanian site of approximately 50 hectares, reported on 6 June 2024.",
  "classification": "fact",
  "confidence": "medium",
  "status": "active",
  "reviewer": "research-agent/blueberry-public-pilot-2026-08-03",
  "created_at": "2026-08-03",
  "evidence_ids": [
    "ev-fruitnet-romania-2024"
  ],
  "entity_ids": [
    "company-fall-creek-farm-and-nursery"
  ]
}
