{
  "id": "fact-berry-blue-hortifrut-jv-claim",
  "record_type": "fact",
  "statement": "Hortifrut describes Berry Blue, LLC as a blueberry breeding joint venture with Michigan Blueberry Growers created over a decade ago, whose varieties are exclusive to Hortifrut, MBG and their producers.",
  "classification": "claim",
  "confidence": "high",
  "status": "active",
  "reviewer": "research-agent/blueberry-public-pilot-2026-08-03",
  "created_at": "2026-08-03",
  "evidence_ids": [
    "ev-hortifrut-genetic-development"
  ],
  "entity_ids": [
    "company-hortifrut",
    "company-berry-blue-llc",
    "company-michigan-blueberry-growers"
  ]
}
