{
  "id": "fact-mbo-history-1",
  "record_type": "fact",
  "statement": "Mountain Blue publishes two different founding years for the same business on its own website: 1975 on its history page and 1978 on its home page. No independent record resolving the discrepancy was retrieved.",
  "classification": "claim",
  "confidence": "low",
  "status": "disputed",
  "reviewer": "research-agent/blueberry-public-pilot-2026-08-03",
  "created_at": "2026-08-03",
  "evidence_ids": [
    "ev-mbo-history",
    "ev-mbo-home"
  ],
  "entity_ids": [
    "company-mountain-blue-orchards"
  ]
}
